{
  "id": "PAT-0014",
  "name": "Circuit Breaker",
  "aka": [
    "Distributed Circuit Breaker"
  ],
  "kind": "pattern",
  "category": "resilience",
  "status": "accepted",
  "problem": "Synchronous failures, excessive latency, or transient timeouts at an outbound dependency cascade backwards: calling threads block, local resource pools fill, and the caller becomes unavailable because its callee is.",
  "forces": [
    "An open breaker fails fast at the cost of rejecting calls that might have succeeded.",
    "Per-process breaker state means each node must independently rediscover the same outage.",
    "Threshold calibration — error count, timeout, cooldown — is where the pattern is usually gotten wrong."
  ],
  "solution": "Every synchronous call to a component the caller does not own is wrapped in a circuit breaker placed in the outbound infrastructure adapter. A failure in the callee must not cascade into a failure of the caller. Breaker state is shared across the cluster rather than held per process, so one node tripping the breaker propagates immediately to its peers.",
  "appliesTo": [
    {
      "topology": "distributed-modules",
      "applicability": "required",
      "guidance": "All synchronous inter-module calls implement the breaker; a module failure must not cascade to caller failure. Enforced by DM-R07."
    },
    {
      "topology": "microservices",
      "applicability": "required",
      "guidance": "Combined with bulkhead isolation (PAT-0015) and fallback behaviour (PAT-0016) on every inter-service call."
    },
    {
      "topology": "modular-monolith",
      "applicability": "optional",
      "guidance": "In-process calls have no network failure mode; the breaker applies only to outbound third-party integrations."
    },
    {
      "topology": "agentic-ai",
      "applicability": "recommended",
      "guidance": "Tool invocations that reach external systems are outbound calls and are wrapped identically."
    }
  ],
  "relationships": [
    {
      "type": "complements",
      "target": "PAT-0015",
      "note": "The bulkhead limits how much of the caller one failing dependency can consume; the breaker stops calling it."
    },
    {
      "type": "requires",
      "target": "PAT-0016",
      "note": "An open breaker must return something; the fallback defines what."
    }
  ],
  "governedBy": [
    {
      "adr": "ADR-0011",
      "track": "core",
      "title": "Fault Tolerance and Resiliency Patterns",
      "href": "../../adrs/core/0011-fault-tolerance-resiliency-patterns.md",
      "verification": "verified",
      "verifiedOn": "2026-07-19",
      "note": "The ADR mandates a distributed circuit breaker with cluster-shared state, plus retry with exponential backoff. It does not cover bulkheads or fallbacks."
    }
  ],
  "enforcedBy": [
    {
      "ruleId": "DM-R07",
      "engine": "topology-ruleset",
      "ruleset": "src/rulesets/topologies/progressive-axis/distributed-modules/distributed-modules.rules.json",
      "statement": "All synchronous inter-module calls MUST implement circuit breaker pattern. A module failure MUST NOT cascade to caller failure."
    },
    {
      "ruleId": "CORE-0011-01",
      "engine": "adr-ruleset",
      "ruleset": "src/rulesets/adr/generated/adr-0011-fault-tolerance-and-resiliency-patterns.rules.json"
    }
  ],
  "sources": [
    {
      "href": "src/rulesets/topologies/progressive-axis/distributed-modules/distributed-modules.rules.json",
      "note": "DM-R07 rule statement. No prose pattern guide documents this pattern."
    },
    {
      "href": "reference/core/architecture/adrs/core/0011-fault-tolerance-resiliency-patterns.md",
      "note": "Recorded decision."
    }
  ]
}
